{
  "name": "user",
  "from": "$project.models.produto",
  "checks": [
    {
      "name": "",
      "condition": ""
    }
  ],
  "rules": ["ALL", "CREATE", "READ", "UPDATE", "DELETE"],
  "fields": [
    {
      "name": "ID",
      "label": "Identificador",
      "type": "input",
      "size": 10,
      "digits": 6,
      "value": "10",
      "format": "text",
      "pattern": "",
      "isRequire": true
    }
  ]
}
